 eax in    eax      ebx      ecx      edx
00000000 00000020 756e6547 6c65746e 49656e69
00000001 000b06a2 08400800 fffaf38b bfcbfbff
00000002 00feff01 000000f0 00000000 00000000
00000003 00000000 00000000 00000000 00000000
00000004 00000000 00000000 00000000 00000000
00000005 00000040 00000040 00000003 00002020
00000006 009f8ff3 00000002 00000409 00010003
00000007 00000000 00000000 00000000 00000000
00000008 00000000 00000000 00000000 00000000
00000009 00000000 00000000 00000000 00000000
0000000a 07300605 00000000 00000007 00008603
0000000b 00000000 00000000 00000038 00000008
0000000c 00000000 00000000 00000000 00000000
0000000d 00000000 00000000 00000000 00000000
0000000e 00000000 00000000 00000000 00000000
0000000f 00000000 00000000 00000000 00000000
00000010 00000000 00000000 00000000 00000000
00000011 00000000 00000000 00000000 00000000
00000012 00000000 00000000 00000000 00000000
00000013 00000000 00000000 00000000 00000000
00000014 00000000 00000000 00000000 00000000
00000015 00000002 000000a6 0249f000 00000000
00000016 00000000 00000000 00000000 00000000
00000017 00000000 00000000 00000000 00000000
00000018 00000000 00000000 00000000 00000000
00000019 00000000 00000000 00000000 00000000
0000001a 00000000 00000000 00000000 00000000
0000001b 00000000 00000000 00000000 00000000
0000001c 4000000b 00000007 00000007 00000000
0000001d 00000000 00000000 00000000 00000000
0000001e 00000000 00000000 00000000 00000000
0000001f 00000000 00000000 00000038 00000008
00000020 00000000 00000001 00000000 00000000
80000000 80000008 00000000 00000000 00000000
80000001 00000000 00000000 00000121 2c100800
80000002 68743331 6e654720 746e4920 52286c65
80000003 6f432029 54286572 6920294d 33312d35
80000004 48303035 00000000 00000000 00000000
80000005 00000000 00000000 00000000 00000000
80000006 00000000 00000000 05007040 00000000
80000007 00000000 00000000 00000000 00000100
80000008 00003027 00000000 00000000 00000000

Undocument layers
80860000 00000000 00000000 00000000 00000000
80860001 00000000 00000000 00000000 00000000
80860002 00000000 00000000 00000000 00000000
80860003 00000000 00000000 00000000 00000000
80860004 00000000 00000000 00000000 00000000
80860005 00000000 00000000 00000000 00000000
80860006 00000000 00000000 00000000 00000000
80860007 00000000 00000000 00000000 00000000
c0000000 00000000 00000000 00000000 00000000
c0000001 00000000 00000000 00000000 00000000
8ffffffe 00000000 00000000 00000000 00000000
8fffffff 00000000 00000000 00000000 00000000

________________________________________________
Vendor ID: "GenuineIntel"; CPUID level 32

Дополнительные функции Intel:
Верисия 000b06a2:
Type 0 - Original OEM
Family 6 - Pentium Pro
Model 10 - 
Stepping 2
Reserved 44

Extended brand string: "13th Gen Intel(R) Core(TM) i5-13500H"
CLFLUSH instruction cache line size: 8
Initial APIC ID: 8
Hyper threading siblings: 64

Feature flags bfcbfbff:
0	FPU	        Присутствует Математический сопроцессор
1	VME	        Поддержка расширенных возможностей обработки прерываний в режиме виртуального i8086
2	DE	        Поддержка отладки
3	PSE	        Поддержка страниц размером 4 MB
4	TSC	        Счетчик меток реального времени
5	MSR	        Поддержка команд rdmsr и wrmsr
6	PAE	        Поддержка физического адреса более 32 бит
7	MCE	        Поддержка исключений 18 - об аппаратных ошибках
8	CX8	        Поддержка инструкции cmpxchg8b
9	APIC	        Микропроцессор содержит программно доступный контроллер прерываний
11	SEP	        Поддержка инструкций быстрых системных вызовов sysenter и sysexit
12	MTRR	        Поддержка регистра mtrr_cap (относится к MSR-регистрам)
13	PGE	        Поддержка глобальных страниц
14	MCA	        Поддержка архитектуры машинного контроля
15	CMOV	        Поддержка инструкций условной пересылки cmov, fcmovcc, fcomi
16	PAT	        Процессор поддерживает таблицу атрибутов страницы
17	PSE-36          Процессор поддерживает 4 MB страницы, которые способны адресовать физическую память до 64 GB
19	CLFLSH          Поддержка инструкции CLFLUSH
22	ACPI	        Управление охлаждением процессора с помощью пустых циклов в зависимости от температуры
23	MMX	        Поддержка MMX
24	FXSR	        Поддержка инструкций FXSAVE и FXRSTOR
25	SSE	        Поддержка SSE
26	SSE2	        Поддержка SSE2
27	SS	        Управление конфликтующими типами памяти
28	HTT	        Поддержка Hyper-Threading
29	TM	        Поддержка автоматического мониторинга температуры
31	SBF	        Сигнал Останова при FERR

TLB and cache info:
ff: unknown TLB/cache descriptor
fe: unknown TLB/cache descriptor
f0: unknown TLB/cache descriptor
Processor serial: 000B-06A2-BFCB-FBFF-FFFA-F38B
